{
  "$schema": "../../../../../schemas/bootstrap-generation-v1.schema.json",
  "formatVersion": 1,
  "status": "VERIFIED",
  "graphDigest": "sha256:aaaaaaaaaaaaaaaaaaaaaaaaaaaaaaaaaaaaaaaaaaaaaaaaaaaaaaaaaaaaaaaa",
  "generationKey": "aaaaaaaaaaaaaaaaaaaaaaaaaaaaaaaaaaaaaaaaaaaaaaaaaaaaaaaaaaaaaaaa",
  "profileId": "coding",
  "npmTreeSha256": "bbbbbbbbbbbbbbbbbbbbbbbbbbbbbbbbbbbbbbbbbbbbbbbbbbbbbbbbbbbbbbbb",
  "packages": [
    {
      "id": "plan-mode",
      "spec": "npm:@narumitw/pi-plan-mode@0.49.3",
      "sourceType": "npm",
      "name": "@narumitw/pi-plan-mode",
      "version": "0.49.3",
      "integrity": "sha512-YWJjZA==",
      "tarballPath": "tarballs/pi-plan-mode-0.49.3.tgz",
      "installedPath": "npm/node_modules/@narumitw/pi-plan-mode",
      "treeSha256": "cccccccccccccccccccccccccccccccccccccccccccccccccccccccccccccccc",
      "lifecycleScripts": [],
      "lifecycleExecution": "DISABLED"
    }
  ],
  "resources": [
    {
      "id": "session-ledger-runtime",
      "type": "library",
      "sourcePath": "extensions/session-ledger/ledger.mjs",
      "stagedPath": "resources/extensions/session-ledger/ledger.mjs",
      "sha256": "dddddddddddddddddddddddddddddddddddddddddddddddddddddddddddddddd",
      "defaultLoaded": false
    }
  ],
  "realizedDigest": "sha256:eeeeeeeeeeeeeeeeeeeeeeeeeeeeeeeeeeeeeeeeeeeeeeeeeeeeeeeeeeeeeeee",
  "manifestDigest": "sha256:ffffffffffffffffffffffffffffffffffffffffffffffffffffffffffffffff"
}
